{
  "$schema": "https://json-schema.org/draft/2020-12/schema",
  "$id": "https://patternlike.app/contracts/m7/pattern-admin-artifact.schema.json",
  "title": "Administrative Pattern artifact projection",
  "$defs": {
    "patternAdminArtifact": {
      "type": "object",
      "additionalProperties": false,
      "required": [
        "schema_version",
        "generation_id",
        "artifact_id",
        "artifact_class",
        "created_at",
        "expires_at",
        "content"
      ],
      "properties": {
        "schema_version": { "$ref": "https://patternlike.app/contracts/m7/common.schema.json#/$defs/schemaVersion" },
        "generation_id": { "$ref": "https://patternlike.app/contracts/m7/common.schema.json#/$defs/generationId" },
        "artifact_id": { "type": "string", "pattern": "^part_[0-9a-f]{32}$" },
        "artifact_class": { "$ref": "https://patternlike.app/contracts/m7/common.schema.json#/$defs/artifactClass" },
        "created_at": { "$ref": "https://patternlike.app/contracts/m0/common.schema.json#/$defs/isoDateTime" },
        "expires_at": { "$ref": "https://patternlike.app/contracts/m0/common.schema.json#/$defs/isoDateTime" },
        "content": { "type": "object" }
      }
    }
  },
  "$ref": "#/$defs/patternAdminArtifact"
}
