{
  "schema_version": "0.7.0",
  "generation_id": "pgen_cccccccccccccccccccccccccccccccc",
  "artifact_id": "part_eeeeeeeeeeeeeeeeeeeeeeeeeeeeeeee",
  "artifact_class": "correction_document",
  "created_at": "2026-08-14T12:00:00Z",
  "expires_at": "2026-09-13T12:00:00Z",
  "content": {
    "schema_version": "0.7.0",
    "finding_codes": [
      "claim_not_entailed"
    ],
    "chapter_keys": [
      "chapter_01"
    ],
    "section_keys": [
      "chapter_01.section_01"
    ],
    "ontology_rule_ids": [
      "ont_aaaaaaaaaaaaaaaaaaaaaaaaaaaaaaaa"
    ]
  }
}
